{
  "schema": "termrock-spec/capture-plan-v1",
  "component_id": "W32",
  "component": "Panel",
  "oracle_commit": "4a79c0a2d40fca46fc406b77157ce3b3f12ec16b",
  "status": "planned_not_captured",
  "authority_policy": "Classify and bind expected output before candidate testing. Existing/ExtractedOracle preserve old behavior; newly introduced robustness or API behavior is Extension. Source directory links are discovery roots, not proof of all-state coverage.",
  "source_urls": [
    "https://github.com/donbeave/terminal-components-claude/blob/4a79c0a2d40fca46fc406b77157ce3b3f12ec16b/src/widgets/panel.rs"
  ],
  "snapshot_discovery_roots": [
    "https://github.com/donbeave/terminal-components-claude/tree/4a79c0a2d40fca46fc406b77157ce3b3f12ec16b/snapshots/showcase/pages/panels"
  ],
  "dimensions": [
    [
      72,
      20
    ],
    [
      80,
      24
    ],
    [
      100,
      30
    ],
    [
      120,
      40
    ],
    [
      160,
      50
    ]
  ],
  "capabilities": [
    "truecolor",
    "256",
    "16",
    "none",
    "nocolor"
  ],
  "state_axes": [
    {
      "axis": "geometry",
      "applies_to": "component",
      "states": [
        "normal",
        "zero_area",
        "tiny_area",
        "nonzero_origin",
        "exact_fit",
        "one_cell_short",
        "unicode_long_content",
        "narrow_then_wide"
      ]
    },
    {
      "axis": "focus_hover",
      "applies_to": "no independent focus stop",
      "states": [],
      "not_applicable_reason": "Display-only surface; Field/Panel may reflect child focus but do not create independent interactive state."
    },
    {
      "axis": "activation",
      "applies_to": "none at this surface",
      "states": [],
      "not_applicable_reason": "No generic whole-surface activation. Text/scroll/selection gestures and child actions are covered by their own cases."
    }
  ],
  "cases": [
    {
      "id": "W32-01",
      "requirement": "card/framed with title, meta and badge at exact-fit widths",
      "required": true,
      "execution_status": "not_executed",
      "authority_lane": "bind_existing_or_extract_oracle_before_candidate"
    },
    {
      "id": "W32-02",
      "requirement": "child focused versus panel itself decorative",
      "required": true,
      "execution_status": "not_executed",
      "authority_lane": "bind_existing_or_extract_oracle_before_candidate"
    },
    {
      "id": "W32-03",
      "requirement": "nested panels and nonzero origins, clipping",
      "required": true,
      "execution_status": "not_executed",
      "authority_lane": "bind_existing_or_extract_oracle_before_candidate"
    },
    {
      "id": "W32-04",
      "requirement": "empty/zero/tiny body and late scroll-count metadata",
      "required": true,
      "execution_status": "not_executed",
      "authority_lane": "bind_existing_or_extract_oracle_before_candidate"
    }
  ],
  "expected_artifacts": null
}
