{
  "schema": "termrock-spec/capture-plan-v1",
  "component_id": "W16",
  "component": "Steps",
  "oracle_commit": "4a79c0a2d40fca46fc406b77157ce3b3f12ec16b",
  "status": "planned_not_captured",
  "authority_policy": "Classify and bind expected output before candidate testing. Existing/ExtractedOracle preserve old behavior; newly introduced robustness or API behavior is Extension. Source directory links are discovery roots, not proof of all-state coverage.",
  "source_urls": [
    "https://github.com/donbeave/terminal-components-claude/blob/4a79c0a2d40fca46fc406b77157ce3b3f12ec16b/src/widgets/steps.rs"
  ],
  "snapshot_discovery_roots": [
    "https://github.com/donbeave/terminal-components-claude/tree/4a79c0a2d40fca46fc406b77157ce3b3f12ec16b/snapshots/showcase/pages/taskrunner",
    "https://github.com/donbeave/terminal-components-claude/tree/4a79c0a2d40fca46fc406b77157ce3b3f12ec16b/snapshots/jackin/cockpit"
  ],
  "dimensions": [
    [
      72,
      20
    ],
    [
      80,
      24
    ],
    [
      100,
      30
    ],
    [
      120,
      40
    ],
    [
      160,
      50
    ]
  ],
  "capabilities": [
    "truecolor",
    "256",
    "16",
    "none",
    "nocolor"
  ],
  "state_axes": [
    {
      "axis": "geometry",
      "applies_to": "component",
      "states": [
        "normal",
        "zero_area",
        "tiny_area",
        "nonzero_origin",
        "exact_fit",
        "one_cell_short",
        "unicode_long_content",
        "narrow_then_wide"
      ]
    },
    {
      "axis": "focus_hover",
      "applies_to": "interactive owner or child; Brand only in interactive mode; Steps only in navigable mode; no decorative focus stop",
      "states": [
        "unfocused",
        "focused",
        "hovered",
        "focus_and_hover",
        "keyboard_suppresses_hover",
        "pointer_motion_restores_hover"
      ]
    },
    {
      "axis": "activation",
      "applies_to": "eligible actionable part; composite uses real child action controls",
      "states": [
        "pointer_down",
        "held_press",
        "release_inside",
        "release_outside",
        "removed_target",
        "disabled_target",
        "keyboard_activate",
        "activation_feedback",
        "feedback_expired"
      ]
    },
    {
      "axis": "source",
      "applies_to": "keyed records; chosen/cursor distinction only when both exist",
      "states": [
        "empty",
        "ready",
        "selected_differs_from_cursor",
        "disabled_entry",
        "reorder",
        "insert",
        "remove",
        "filter",
        "stale_target"
      ]
    },
    {
      "axis": "readiness",
      "applies_to": "explicit readiness or item lifecycle supplied by caller, not synthetic whole-widget states",
      "states": [
        "loading",
        "partial",
        "error",
        "retry_or_refresh_when_offered"
      ]
    },
    {
      "axis": "scroll",
      "applies_to": "component scroll region; horizontal strips use start/end; fade/protection only on applicable content rows",
      "states": [
        "no_overflow",
        "start",
        "middle",
        "end",
        "wheel_boundary",
        "thumb_drag",
        "resize_while_scrolled",
        "edge_fade",
        "protected_row"
      ]
    },
    {
      "axis": "motion",
      "applies_to": "explicit animation sample; static completion/failure is tested only where the supplied status supports it",
      "states": [
        "all_unique_phases",
        "phase_wrap",
        "before_at_after_boundary",
        "paused",
        "reduced",
        "same_time_repaint"
      ]
    }
  ],
  "cases": [
    {
      "id": "W16-01",
      "requirement": "every lifecycle state including skipped and blocked",
      "required": true,
      "execution_status": "not_executed",
      "authority_lane": "bind_existing_or_extract_oracle_before_candidate"
    },
    {
      "id": "W16-02",
      "requirement": "running spinner through all unique phases",
      "required": true,
      "execution_status": "not_executed",
      "authority_lane": "bind_existing_or_extract_oracle_before_candidate"
    },
    {
      "id": "W16-03",
      "requirement": "navigation to a failed step without changing the caller lifecycle",
      "required": true,
      "execution_status": "not_executed",
      "authority_lane": "bind_existing_or_extract_oracle_before_candidate"
    },
    {
      "id": "W16-04",
      "requirement": "partial details/long labels and overflow",
      "required": true,
      "execution_status": "not_executed",
      "authority_lane": "bind_existing_or_extract_oracle_before_candidate"
    },
    {
      "id": "W16-05",
      "requirement": "live source replacement preserves current key",
      "required": true,
      "execution_status": "not_executed",
      "authority_lane": "bind_existing_or_extract_oracle_before_candidate"
    }
  ],
  "expected_artifacts": null
}
